{
  "page": "homepage",
  "status": "draft",
  "assets": [
    {
      "id": "concept-top",
      "kind": "concept-screenshot",
      "status": "generated",
      "required_by": "desktop segment concept review",
      "path": "pages/homepage/concept-top.png",
      "source": "image_gen",
      "generated_visual_fit": {
        "intended_purpose": "Creative desktop top segment concept used for planning, not shipped UI.",
        "consumed_by_region": "top segment planning artifact",
        "supports_product_function": true,
        "could_be_mistaken_for_real_feature": false,
        "distracts_from_primary_task": false,
        "css_svg_or_code_native_more_appropriate": false,
        "decision": "use",
        "alt_text_or_decorative_hidden": "not-applicable for planning artifact"
      },
      "notes": "Inspected and approved before implementation. Middle and bottom segment concepts follow the same contract."
    },
    {
      "id": "hero-product",
      "kind": "hero-image",
      "status": "generated",
      "required_by": "hero",
      "path": "pages/homepage/assets/hero-product.png",
      "source": "image_gen",
      "alt_text": "Product arranged in the approved hero composition.",
      "generated_visual_fit": {
        "intended_purpose": "Support hero product understanding.",
        "consumed_by_region": "hero",
        "supports_product_function": true,
        "could_be_mistaken_for_real_feature": false,
        "distracts_from_primary_task": false,
        "css_svg_or_code_native_more_appropriate": false,
        "decision": "use",
        "alt_text_or_decorative_hidden": "Product arranged in the approved hero composition."
      }
    },
    {
      "id": "product-card-01",
      "kind": "product-card-image",
      "status": "generated",
      "required_by": "product-grid",
      "path": "pages/homepage/assets/product-card-01.png",
      "source": "image_gen",
      "alt_text": "Primary product package.",
      "generated_visual_fit": {
        "intended_purpose": "Show product-card image content.",
        "consumed_by_region": "product-grid",
        "supports_product_function": true,
        "could_be_mistaken_for_real_feature": false,
        "distracts_from_primary_task": false,
        "css_svg_or_code_native_more_appropriate": false,
        "decision": "use",
        "alt_text_or_decorative_hidden": "Primary product package."
      }
    },
    {
      "id": "footer-device",
      "kind": "app-device-image",
      "status": "not-generated-with-reason",
      "required_by": "footer app/download module",
      "source": "not-applicable",
      "notes": "Concept showed no app/download module; no footer device image required."
    }
  ],
  "review": {
    "all_referenced_assets_exist": true,
    "missing_assets": [],
    "notes": "Every asset referenced by page HTML/CSS/review exists locally."
  }
}
